{
  "schema_version": "motionkb/v4",
  "action_id": null,
  "status": "candidate",
  "source_clip": {
    "fbx_or_anim": "mx_Man_Working_On_Device.fbx",
    "guid": "520dbafcef4dcaa4ebc190203651acea",
    "file_id": -203655887218126122,
    "clip_name": "mx_Man_Working_On_Device"
  },
  "controller_state": null,
  "controller_layer": null,
  "trigger_param": null,
  "duration": 6.433,
  "frame_rate": 30,
  "loop": false,
  "action_description": null,
  "channels": {
    "root": {
      "state_label": "dynamic",
      "motion_magnitude": 0.0412,
      "raw_measurement": {
        "signal": "max(trans/1.9782, vert/1.8396, heading/131.8575)",
        "body_trans_horiz_stddev": 0.02439,
        "body_vert_range": 0.07573,
        "body_heading_stddev_deg": 5.026
      },
      "mean_body_height": 0.55857,
      "mean_body_tilt_deg": 36.531
    },
    "torso": {
      "state_label": "dynamic",
      "motion_magnitude": 0.3038,
      "raw_measurement": {
        "signal": "muscle_dof_stddev_rms",
        "raw_value": 0.09021,
        "divisor": 0.2969
      },
      "motion_description": null,
      "mean_pose": {
        "Spine Front-Back": -0.6535,
        "Spine Left-Right": 0.3135,
        "Spine Twist Left-Right": 0.07705,
        "Chest Front-Back": -0.19317,
        "Chest Left-Right": 0.07708,
        "Chest Twist Left-Right": 0.0146,
        "UpperChest Front-Back": -0.38641,
        "UpperChest Left-Right": 0.15465,
        "UpperChest Twist Left-Right": 0.02532
      }
    },
    "head": {
      "state_label": "dynamic",
      "motion_magnitude": 0.288,
      "raw_measurement": {
        "signal": "muscle_dof_stddev_rms",
        "raw_value": 0.14294,
        "divisor": 0.4963
      },
      "motion_description": null,
      "mean_pose": {
        "Neck Nod Down-Up": -0.28751,
        "Neck Tilt Left-Right": 0.07395,
        "Neck Turn Left-Right": 0.04382,
        "Head Nod Down-Up": -0.22642,
        "Head Tilt Left-Right": 0.15055,
        "Head Turn Left-Right": 0.26354
      }
    },
    "left_arm": {
      "state_label": "dynamic",
      "motion_magnitude": 0.2441,
      "raw_measurement": {
        "signal": "muscle_dof_stddev_rms",
        "raw_value": 0.16754,
        "divisor": 0.6864
      },
      "motion_description": null,
      "mean_pose": {
        "Left Shoulder Down-Up": 0.00814,
        "Left Shoulder Front-Back": -0.4053,
        "Left Arm Down-Up": -0.13058,
        "Left Arm Front-Back": -0.30034,
        "Left Arm Twist In-Out": -0.01012,
        "Left Forearm Stretch": 0.40498,
        "Left Forearm Twist In-Out": -0.53417,
        "Left Hand Down-Up": 0.76021,
        "Left Hand In-Out": 0.15839
      }
    },
    "right_arm": {
      "state_label": "dynamic",
      "motion_magnitude": 0.237,
      "raw_measurement": {
        "signal": "muscle_dof_stddev_rms",
        "raw_value": 0.16269,
        "divisor": 0.6864
      },
      "motion_description": null,
      "mean_pose": {
        "Right Shoulder Down-Up": -0.15037,
        "Right Shoulder Front-Back": 0.00559,
        "Right Arm Down-Up": 0.14178,
        "Right Arm Front-Back": -0.11423,
        "Right Arm Twist In-Out": 0.023,
        "Right Forearm Stretch": 0.20256,
        "Right Forearm Twist In-Out": -0.36963,
        "Right Hand Down-Up": 0.41783,
        "Right Hand In-Out": -0.57702
      }
    },
    "left_leg": {
      "state_label": "dynamic",
      "motion_magnitude": 0.176,
      "raw_measurement": {
        "signal": "muscle_dof_stddev_rms",
        "raw_value": 0.07863,
        "divisor": 0.4468
      },
      "motion_description": null,
      "mean_pose": {
        "Left Upper Leg Front-Back": -0.00223,
        "Left Upper Leg In-Out": 0.31304,
        "Left Upper Leg Twist In-Out": 0.0544,
        "Left Lower Leg Stretch": -0.4935,
        "Left Lower Leg Twist In-Out": 0.12625,
        "Left Foot Up-Down": -0.02202,
        "Left Foot Twist In-Out": 0.26434,
        "Left Toes Up-Down": 0.04929
      }
    },
    "right_leg": {
      "state_label": "dynamic",
      "motion_magnitude": 0.1723,
      "raw_measurement": {
        "signal": "muscle_dof_stddev_rms",
        "raw_value": 0.07698,
        "divisor": 0.4468
      },
      "motion_description": null,
      "mean_pose": {
        "Right Upper Leg Front-Back": -0.68614,
        "Right Upper Leg In-Out": 0.40416,
        "Right Upper Leg Twist In-Out": 0.35681,
        "Right Lower Leg Stretch": -0.34277,
        "Right Lower Leg Twist In-Out": 0.02799,
        "Right Foot Up-Down": -0.43679,
        "Right Foot Twist In-Out": -0.22635,
        "Right Toes Up-Down": -0.09235
      }
    },
    "left_hand": {
      "state_label": "dynamic",
      "motion_magnitude": 0.5196,
      "raw_measurement": {
        "signal": "muscle_dof_stddev_rms",
        "raw_value": 0.3921,
        "divisor": 0.7546
      },
      "motion_description": null,
      "mean_pose": {
        "Left Thumb 1 Stretched": -1.56498,
        "Left Thumb Spread": -0.46947,
        "Left Thumb 2 Stretched": -0.12608,
        "Left Thumb 3 Stretched": 0.43312,
        "Left Index 1 Stretched": 0.261,
        "Left Index Spread": -0.16257,
        "Left Index 2 Stretched": 0.03713,
        "Left Index 3 Stretched": 0.5347,
        "Left Middle 1 Stretched": 0.33605,
        "Left Middle Spread": -0.68696,
        "Left Middle 2 Stretched": 0.0546,
        "Left Middle 3 Stretched": 0.40796,
        "Left Ring 1 Stretched": 0.47582,
        "Left Ring Spread": 0.31204,
        "Left Ring 2 Stretched": 0.25683,
        "Left Ring 3 Stretched": 0.38997,
        "Left Little 1 Stretched": 0.51158,
        "Left Little Spread": 0.13289,
        "Left Little 2 Stretched": -0.14717,
        "Left Little 3 Stretched": -0.03175
      }
    },
    "right_hand": {
      "state_label": "dynamic",
      "motion_magnitude": 0.4248,
      "raw_measurement": {
        "signal": "muscle_dof_stddev_rms",
        "raw_value": 0.32053,
        "divisor": 0.7546
      },
      "motion_description": null,
      "mean_pose": {
        "Right Thumb 1 Stretched": -1.63318,
        "Right Thumb Spread": 0.33518,
        "Right Thumb 2 Stretched": 0.48163,
        "Right Thumb 3 Stretched": 0.63341,
        "Right Index 1 Stretched": 0.37628,
        "Right Index Spread": -0.07118,
        "Right Index 2 Stretched": 0.03865,
        "Right Index 3 Stretched": 0.29142,
        "Right Middle 1 Stretched": 0.38517,
        "Right Middle Spread": -0.5254,
        "Right Middle 2 Stretched": 0.07885,
        "Right Middle 3 Stretched": 0.46419,
        "Right Ring 1 Stretched": 0.29651,
        "Right Ring Spread": -0.5623,
        "Right Ring 2 Stretched": -0.04254,
        "Right Ring 3 Stretched": 0.56173,
        "Right Little 1 Stretched": 0.14561,
        "Right Little Spread": -0.44154,
        "Right Little 2 Stretched": 0.03226,
        "Right Little 3 Stretched": 0.3873
      }
    }
  },
  "extraction": {
    "method": "in_engine_sample_root_local",
    "sampled_frames": 193,
    "sampling_rule": "clamp(round(duration*frame_rate),2,600), native rate, HumanPose muscles + bodyPosition/bodyRotation",
    "motion_metric": "variation, all 8 anatomical channels: muscle_dof_stddev_rms, divided by torso 0.2969 / head 0.4963 / arm 0.6864 / leg 0.4468 / hand 0.7546; root variation: max(trans/1.9782, vert/1.8396, heading/131.8575) from HumanPose.bodyPosition and bodyRotation; mean pose, all 8 anatomical channels: mean_pose, the per-frame mean of each of the channel's Humanoid muscle degrees of freedom in Unity's normalised muscle space, stored as the vector it is and compared with nothing; root mean pose: mean_body_height (mean HumanPose.bodyPosition.y, normalised humanoid units) and mean_body_tilt_deg (mean angle of bodyRotation's up axis from world up)",
    "bone_map_version": "v2.0.0",
    "metric_formula_version": "v3.0.0",
    "extractor_version": "4.0.0",
    "extractor_lang": "python",
    "avatar": "nurse_avatar.fbx",
    "extracted_at": "2026-08-26T21:32:14Z",
    "field_origin": {
      "kinematic": [
        "duration",
        "frame_rate",
        "channels.*.state_label",
        "channels.*.motion_magnitude",
        "channels.*.raw_measurement",
        "channels.*.mean_pose",
        "channels.root.mean_body_height",
        "channels.root.mean_body_tilt_deg"
      ],
      "resolved": [
        "controller_state",
        "controller_layer",
        "trigger_param"
      ],
      "semantic_pending": [
        "action_description",
        "channels.*.motion_description"
      ]
    },
    "verified_against_screenshots": false
  }
}
