{
  "schema_version": "motionkb/v4",
  "action_id": "mx_Left_Leg_On_Object_Left_Hand_On_Knee_Right_Hand_On_Hip",
  "status": "accepted",
  "source_clip": {
    "fbx_or_anim": "mx_Left_Leg_On_Object_Left_Hand_On_Knee_Right_Hand_On_Hip.fbx",
    "guid": "78556a79f75ce9741a94d4e3be8d53b4",
    "file_id": -203655887218126122,
    "clip_name": "mx_Left_Leg_On_Object_Left_Hand_On_Knee_Right_Hand_On_Hip"
  },
  "controller_state": null,
  "controller_layer": null,
  "trigger_param": null,
  "duration": 0.033,
  "frame_rate": 30,
  "loop": false,
  "action_description": "The figure holds a static pose with the left leg raised onto an unseen object, resting the left hand on the knee while placing the right hand on the hip.",
  "channels": {
    "root": {
      "state_label": "static",
      "motion_magnitude": 0.0,
      "raw_measurement": {
        "signal": "max(trans/1.9782, vert/1.8396, heading/131.8575)",
        "body_trans_horiz_stddev": 0.0,
        "body_vert_range": 0.0,
        "body_heading_stddev_deg": 0.0
      },
      "mean_body_height": 1.02267,
      "mean_body_tilt_deg": 6.889
    },
    "torso": {
      "state_label": "static",
      "motion_magnitude": 0.0,
      "raw_measurement": {
        "signal": "muscle_dof_stddev_rms",
        "raw_value": 0.0,
        "divisor": 0.2969
      },
      "motion_description": "The torso remains upright and stationary throughout the clip.",
      "mean_pose": {
        "Spine Front-Back": -0.23564,
        "Spine Left-Right": -0.08069,
        "Spine Twist Left-Right": 0.00624,
        "Chest Front-Back": -0.19881,
        "Chest Left-Right": -0.0563,
        "Chest Twist Left-Right": 0.01543,
        "UpperChest Front-Back": 0.4456,
        "UpperChest Left-Right": -0.12629,
        "UpperChest Twist Left-Right": 0.05804
      }
    },
    "head": {
      "state_label": "static",
      "motion_magnitude": 0.0,
      "raw_measurement": {
        "signal": "muscle_dof_stddev_rms",
        "raw_value": 0.0,
        "divisor": 0.4963
      },
      "motion_description": "The head stays level and faces forward without moving.",
      "mean_pose": {
        "Neck Nod Down-Up": 0.03289,
        "Neck Tilt Left-Right": 0.12914,
        "Neck Turn Left-Right": -0.16628,
        "Head Nod Down-Up": 0.03992,
        "Head Tilt Left-Right": -0.06512,
        "Head Turn Left-Right": -0.26482
      }
    },
    "left_arm": {
      "state_label": "static",
      "motion_magnitude": 0.0,
      "raw_measurement": {
        "signal": "muscle_dof_stddev_rms",
        "raw_value": 0.0,
        "divisor": 0.6864
      },
      "motion_description": "The left arm is bent at the elbow, holding its position with the forearm angled downward toward the raised leg.",
      "mean_pose": {
        "Left Shoulder Down-Up": -0.07184,
        "Left Shoulder Front-Back": -0.36155,
        "Left Arm Down-Up": -0.24876,
        "Left Arm Front-Back": 0.0817,
        "Left Arm Twist In-Out": -0.02851,
        "Left Forearm Stretch": 0.18382,
        "Left Forearm Twist In-Out": -0.36175,
        "Left Hand Down-Up": -0.01384,
        "Left Hand In-Out": 0.24051
      }
    },
    "right_arm": {
      "state_label": "static",
      "motion_magnitude": 0.0,
      "raw_measurement": {
        "signal": "muscle_dof_stddev_rms",
        "raw_value": 0.0,
        "divisor": 0.6864
      },
      "motion_description": "The right arm is bent with the elbow flared outward, keeping the hand positioned against the side of the body.",
      "mean_pose": {
        "Right Shoulder Down-Up": 0.08182,
        "Right Shoulder Front-Back": -1.25588,
        "Right Arm Down-Up": -0.30259,
        "Right Arm Front-Back": 0.51737,
        "Right Arm Twist In-Out": -0.51889,
        "Right Forearm Stretch": -0.02659,
        "Right Forearm Twist In-Out": -0.2434,
        "Right Hand Down-Up": 0.24349,
        "Right Hand In-Out": -0.52256
      }
    },
    "left_leg": {
      "state_label": "static",
      "motion_magnitude": 0.0,
      "raw_measurement": {
        "signal": "muscle_dof_stddev_rms",
        "raw_value": 0.0,
        "divisor": 0.4468
      },
      "motion_description": "The left leg is lifted with the thigh raised horizontally and the knee bent, as if resting on a surface.",
      "mean_pose": {
        "Left Upper Leg Front-Back": -0.62521,
        "Left Upper Leg In-Out": 0.30431,
        "Left Upper Leg Twist In-Out": 0.08029,
        "Left Lower Leg Stretch": -0.07011,
        "Left Lower Leg Twist In-Out": -0.03021,
        "Left Foot Up-Down": 0.15665,
        "Left Foot Twist In-Out": -0.3047,
        "Left Toes Up-Down": 0.05228
      }
    },
    "right_leg": {
      "state_label": "static",
      "motion_magnitude": 0.0,
      "raw_measurement": {
        "signal": "muscle_dof_stddev_rms",
        "raw_value": 0.0,
        "divisor": 0.4468
      },
      "motion_description": "The right leg stands straight and vertical, supporting the full weight of the body.",
      "mean_pose": {
        "Right Upper Leg Front-Back": 0.60928,
        "Right Upper Leg In-Out": 0.01581,
        "Right Upper Leg Twist In-Out": 0.1633,
        "Right Lower Leg Stretch": 0.80318,
        "Right Lower Leg Twist In-Out": 0.00304,
        "Right Foot Up-Down": -0.26725,
        "Right Foot Twist In-Out": 0.0987,
        "Right Toes Up-Down": -0.03865
      }
    },
    "left_hand": {
      "state_label": "static",
      "motion_magnitude": 0.0,
      "raw_measurement": {
        "signal": "muscle_dof_stddev_rms",
        "raw_value": 0.0,
        "divisor": 0.7546
      },
      "motion_description": "The left hand rests flat on top of the left knee.",
      "mean_pose": {
        "Left Thumb 1 Stretched": -0.98714,
        "Left Thumb Spread": -0.0392,
        "Left Thumb 2 Stretched": -0.05527,
        "Left Thumb 3 Stretched": 0.02206,
        "Left Index 1 Stretched": 0.17883,
        "Left Index Spread": -0.78041,
        "Left Index 2 Stretched": 0.19936,
        "Left Index 3 Stretched": 0.25634,
        "Left Middle 1 Stretched": 0.27531,
        "Left Middle Spread": -2.0833,
        "Left Middle 2 Stretched": 0.09527,
        "Left Middle 3 Stretched": 0.43512,
        "Left Ring 1 Stretched": 0.35728,
        "Left Ring Spread": 1.00138,
        "Left Ring 2 Stretched": 0.0044,
        "Left Ring 3 Stretched": 0.39292,
        "Left Little 1 Stretched": 0.23112,
        "Left Little Spread": -0.1031,
        "Left Little 2 Stretched": 0.10293,
        "Left Little 3 Stretched": 0.53399
      }
    },
    "right_hand": {
      "state_label": "static",
      "motion_magnitude": 0.0,
      "raw_measurement": {
        "signal": "muscle_dof_stddev_rms",
        "raw_value": 0.0,
        "divisor": 0.7546
      },
      "motion_description": "The right hand is placed on the right hip in a static posture.",
      "mean_pose": {
        "Right Thumb 1 Stretched": -0.38412,
        "Right Thumb Spread": -1.15116,
        "Right Thumb 2 Stretched": 0.63831,
        "Right Thumb 3 Stretched": 1.35088,
        "Right Index 1 Stretched": 0.7502,
        "Right Index Spread": -0.6449,
        "Right Index 2 Stretched": 0.67084,
        "Right Index 3 Stretched": 0.76305,
        "Right Middle 1 Stretched": 0.44732,
        "Right Middle Spread": -1.88859,
        "Right Middle 2 Stretched": -0.46285,
        "Right Middle 3 Stretched": -0.88189,
        "Right Ring 1 Stretched": 0.17212,
        "Right Ring Spread": 0.95074,
        "Right Ring 2 Stretched": -0.19901,
        "Right Ring 3 Stretched": 0.18952,
        "Right Little 1 Stretched": 0.06312,
        "Right Little Spread": -0.13763,
        "Right Little 2 Stretched": -0.08262,
        "Right Little 3 Stretched": 0.34845
      }
    }
  },
  "extraction": {
    "method": "in_engine_sample_root_local",
    "sampled_frames": 2,
    "sampling_rule": "clamp(round(duration*frame_rate),2,600), native rate, HumanPose muscles + bodyPosition/bodyRotation",
    "motion_metric": "variation, all 8 anatomical channels: muscle_dof_stddev_rms, divided by torso 0.2969 / head 0.4963 / arm 0.6864 / leg 0.4468 / hand 0.7546; root variation: max(trans/1.9782, vert/1.8396, heading/131.8575) from HumanPose.bodyPosition and bodyRotation; mean pose, all 8 anatomical channels: mean_pose, the per-frame mean of each of the channel's Humanoid muscle degrees of freedom in Unity's normalised muscle space, stored as the vector it is and compared with nothing; root mean pose: mean_body_height (mean HumanPose.bodyPosition.y, normalised humanoid units) and mean_body_tilt_deg (mean angle of bodyRotation's up axis from world up)",
    "bone_map_version": "v2.0.0",
    "metric_formula_version": "v3.0.0",
    "extractor_version": "4.0.0",
    "extractor_lang": "python",
    "avatar": "nurse_avatar.fbx",
    "extracted_at": "2026-08-26T21:31:44Z",
    "field_origin": {
      "kinematic": [
        "duration",
        "frame_rate",
        "channels.*.state_label",
        "channels.*.motion_magnitude",
        "channels.*.raw_measurement",
        "channels.*.mean_pose",
        "channels.root.mean_body_height",
        "channels.root.mean_body_tilt_deg"
      ],
      "resolved": [
        "controller_state",
        "controller_layer",
        "trigger_param"
      ],
      "vlm_proposed": [
        "action_description",
        "channels.*.motion_description"
      ],
      "semantic": [
        "action_description",
        "channels.*.motion_description"
      ]
    },
    "verified_against_screenshots": false,
    "vlm_proposal": {
      "model": "qwen3.8-27b",
      "proposed_at": "2026-08-28T01:17:03Z",
      "frames": 16,
      "render_views": [
        "back",
        "back_left",
        "back_right",
        "front",
        "front_left",
        "front_right",
        "left",
        "right"
      ],
      "consistency_validated": true,
      "scope": [
        "action_description",
        "channels.*.motion_description"
      ],
      "status": "vlm_accepted"
    }
  }
}
