{
  "schema_version": "motionkb/v4",
  "action_id": "mx_Sitting_At_A_Computer_And_Typing",
  "status": "accepted",
  "source_clip": {
    "fbx_or_anim": "mx_Sitting_At_A_Computer_And_Typing.fbx",
    "guid": "de517704b5ac28c42bcd7f99da9e16d9",
    "file_id": -203655887218126122,
    "clip_name": "mx_Sitting_At_A_Computer_And_Typing"
  },
  "controller_state": null,
  "controller_layer": null,
  "trigger_param": null,
  "duration": 16.467,
  "frame_rate": 30,
  "loop": false,
  "action_description": "The figure sits and types with both hands, moving its fingers in a rhythmic motion.",
  "channels": {
    "root": {
      "state_label": "static",
      "motion_magnitude": 0.0145,
      "raw_measurement": {
        "signal": "max(trans/1.9782, vert/1.8396, heading/131.8575)",
        "body_trans_horiz_stddev": 0.01235,
        "body_vert_range": 0.00769,
        "body_heading_stddev_deg": 1.907
      },
      "mean_body_height": 0.64699,
      "mean_body_tilt_deg": 8.661
    },
    "torso": {
      "state_label": "dynamic",
      "motion_magnitude": 0.1235,
      "raw_measurement": {
        "signal": "muscle_dof_stddev_rms",
        "raw_value": 0.03668,
        "divisor": 0.2969
      },
      "motion_description": "The torso remains seated upright, leaning slightly forward to maintain the typing posture.",
      "mean_pose": {
        "Spine Front-Back": -0.52169,
        "Spine Left-Right": -0.07309,
        "Spine Twist Left-Right": -0.04102,
        "Chest Front-Back": -0.07217,
        "Chest Left-Right": -0.00495,
        "Chest Twist Left-Right": -0.01175,
        "UpperChest Front-Back": -0.14422,
        "UpperChest Left-Right": -0.01782,
        "UpperChest Twist Left-Right": -0.02291
      }
    },
    "head": {
      "state_label": "dynamic",
      "motion_magnitude": 0.1417,
      "raw_measurement": {
        "signal": "muscle_dof_stddev_rms",
        "raw_value": 0.0703,
        "divisor": 0.4963
      },
      "motion_description": "The head is held steady and faces forward, looking down at the hands.",
      "mean_pose": {
        "Neck Nod Down-Up": -0.11571,
        "Neck Tilt Left-Right": 0.00511,
        "Neck Turn Left-Right": 0.02074,
        "Head Nod Down-Up": 0.3627,
        "Head Tilt Left-Right": 0.06129,
        "Head Turn Left-Right": -0.02411
      }
    },
    "left_arm": {
      "state_label": "dynamic",
      "motion_magnitude": 0.1251,
      "raw_measurement": {
        "signal": "muscle_dof_stddev_rms",
        "raw_value": 0.08589,
        "divisor": 0.6864
      },
      "motion_description": "The left arm is bent at the elbow, holding the forearm horizontally in front of the body.",
      "mean_pose": {
        "Left Shoulder Down-Up": -0.69073,
        "Left Shoulder Front-Back": -0.86074,
        "Left Arm Down-Up": 0.01635,
        "Left Arm Front-Back": -0.13795,
        "Left Arm Twist In-Out": 0.09708,
        "Left Forearm Stretch": 0.28149,
        "Left Forearm Twist In-Out": -0.39879,
        "Left Hand Down-Up": 0.27464,
        "Left Hand In-Out": -0.03122
      }
    },
    "right_arm": {
      "state_label": "dynamic",
      "motion_magnitude": 0.1925,
      "raw_measurement": {
        "signal": "muscle_dof_stddev_rms",
        "raw_value": 0.13213,
        "divisor": 0.6864
      },
      "motion_description": "The right arm is bent at the elbow, mirroring the left arm's position for typing.",
      "mean_pose": {
        "Right Shoulder Down-Up": -0.81553,
        "Right Shoulder Front-Back": -1.23617,
        "Right Arm Down-Up": 0.12594,
        "Right Arm Front-Back": -0.1821,
        "Right Arm Twist In-Out": -0.05692,
        "Right Forearm Stretch": 0.44721,
        "Right Forearm Twist In-Out": -0.30649,
        "Right Hand Down-Up": 0.42224,
        "Right Hand In-Out": 0.11006
      }
    },
    "left_leg": {
      "state_label": "static",
      "motion_magnitude": 0.0237,
      "raw_measurement": {
        "signal": "muscle_dof_stddev_rms",
        "raw_value": 0.01058,
        "divisor": 0.4468
      },
      "motion_description": "The left leg is bent at the knee, supporting the sitting posture.",
      "mean_pose": {
        "Left Upper Leg Front-Back": -0.5774,
        "Left Upper Leg In-Out": 0.23177,
        "Left Upper Leg Twist In-Out": 0.13719,
        "Left Lower Leg Stretch": -0.10794,
        "Left Lower Leg Twist In-Out": -0.08744,
        "Left Foot Up-Down": 0.08862,
        "Left Foot Twist In-Out": 0.10556,
        "Left Toes Up-Down": 0.0
      }
    },
    "right_leg": {
      "state_label": "static",
      "motion_magnitude": 0.0234,
      "raw_measurement": {
        "signal": "muscle_dof_stddev_rms",
        "raw_value": 0.01047,
        "divisor": 0.4468
      },
      "motion_description": "The right leg is bent at the knee, supporting the sitting posture.",
      "mean_pose": {
        "Right Upper Leg Front-Back": -0.57987,
        "Right Upper Leg In-Out": 0.17688,
        "Right Upper Leg Twist In-Out": 0.12571,
        "Right Lower Leg Stretch": -0.13651,
        "Right Lower Leg Twist In-Out": 0.13363,
        "Right Foot Up-Down": 0.01881,
        "Right Foot Twist In-Out": 0.11072,
        "Right Toes Up-Down": -0.0025
      }
    },
    "left_hand": {
      "state_label": "dynamic",
      "motion_magnitude": 0.2382,
      "raw_measurement": {
        "signal": "muscle_dof_stddev_rms",
        "raw_value": 0.17974,
        "divisor": 0.7546
      },
      "motion_description": "The left hand hovers in front of the body, with fingers moving independently as if striking keys.",
      "mean_pose": {
        "Left Thumb 1 Stretched": -1.61151,
        "Left Thumb Spread": -0.21194,
        "Left Thumb 2 Stretched": 0.12818,
        "Left Thumb 3 Stretched": 0.4138,
        "Left Index 1 Stretched": 0.38275,
        "Left Index Spread": -0.68314,
        "Left Index 2 Stretched": 0.00999,
        "Left Index 3 Stretched": 0.6882,
        "Left Middle 1 Stretched": 0.47076,
        "Left Middle Spread": -1.33727,
        "Left Middle 2 Stretched": -0.00026,
        "Left Middle 3 Stretched": 0.31492,
        "Left Ring 1 Stretched": 0.57414,
        "Left Ring Spread": 1.01367,
        "Left Ring 2 Stretched": 0.19158,
        "Left Ring 3 Stretched": 0.06473,
        "Left Little 1 Stretched": 0.49125,
        "Left Little Spread": 0.25481,
        "Left Little 2 Stretched": 0.21083,
        "Left Little 3 Stretched": 0.41644
      }
    },
    "right_hand": {
      "state_label": "dynamic",
      "motion_magnitude": 0.3008,
      "raw_measurement": {
        "signal": "muscle_dof_stddev_rms",
        "raw_value": 0.22698,
        "divisor": 0.7546
      },
      "motion_description": "The right hand hovers in front of the body, with fingers moving independently as if striking keys.",
      "mean_pose": {
        "Right Thumb 1 Stretched": -1.36555,
        "Right Thumb Spread": -0.24178,
        "Right Thumb 2 Stretched": 0.14441,
        "Right Thumb 3 Stretched": 0.35806,
        "Right Index 1 Stretched": 0.13997,
        "Right Index Spread": -0.64692,
        "Right Index 2 Stretched": 0.01359,
        "Right Index 3 Stretched": 0.66923,
        "Right Middle 1 Stretched": 0.2554,
        "Right Middle Spread": -1.34746,
        "Right Middle 2 Stretched": 0.0701,
        "Right Middle 3 Stretched": 0.73837,
        "Right Ring 1 Stretched": 0.15793,
        "Right Ring Spread": 0.52887,
        "Right Ring 2 Stretched": 0.32537,
        "Right Ring 3 Stretched": 0.60394,
        "Right Little 1 Stretched": 0.24094,
        "Right Little Spread": 0.31333,
        "Right Little 2 Stretched": 0.22821,
        "Right Little 3 Stretched": 0.37113
      }
    }
  },
  "extraction": {
    "method": "in_engine_sample_root_local",
    "sampled_frames": 494,
    "sampling_rule": "clamp(round(duration*frame_rate),2,600), native rate, HumanPose muscles + bodyPosition/bodyRotation",
    "motion_metric": "variation, all 8 anatomical channels: muscle_dof_stddev_rms, divided by torso 0.2969 / head 0.4963 / arm 0.6864 / leg 0.4468 / hand 0.7546; root variation: max(trans/1.9782, vert/1.8396, heading/131.8575) from HumanPose.bodyPosition and bodyRotation; mean pose, all 8 anatomical channels: mean_pose, the per-frame mean of each of the channel's Humanoid muscle degrees of freedom in Unity's normalised muscle space, stored as the vector it is and compared with nothing; root mean pose: mean_body_height (mean HumanPose.bodyPosition.y, normalised humanoid units) and mean_body_tilt_deg (mean angle of bodyRotation's up axis from world up)",
    "bone_map_version": "v2.0.0",
    "metric_formula_version": "v3.0.0",
    "extractor_version": "4.0.0",
    "extractor_lang": "python",
    "avatar": "nurse_avatar.fbx",
    "extracted_at": "2026-08-26T21:33:35Z",
    "field_origin": {
      "kinematic": [
        "duration",
        "frame_rate",
        "channels.*.state_label",
        "channels.*.motion_magnitude",
        "channels.*.raw_measurement",
        "channels.*.mean_pose",
        "channels.root.mean_body_height",
        "channels.root.mean_body_tilt_deg"
      ],
      "resolved": [
        "controller_state",
        "controller_layer",
        "trigger_param"
      ],
      "vlm_proposed": [
        "action_description",
        "channels.*.motion_description"
      ],
      "semantic": [
        "action_description",
        "channels.*.motion_description"
      ]
    },
    "verified_against_screenshots": false,
    "vlm_proposal": {
      "model": "qwen3.8-27b",
      "proposed_at": "2026-08-28T01:47:27Z",
      "frames": 24,
      "render_views": [
        "back",
        "back_left",
        "back_right",
        "front",
        "front_left",
        "front_right",
        "left",
        "right"
      ],
      "consistency_validated": true,
      "scope": [
        "action_description",
        "channels.*.motion_description"
      ],
      "status": "vlm_accepted"
    }
  }
}
